{
 "format": 1,
 "id": "skrot.szydelko.us-uk-1",
 "rzemioslo": "szydelko",
 "rodzaj": "skrot",
 "klucze": {
  "nazwa": "atlas.skrot.szydelko.us-uk-1.nazwa"
 },
 "terminy": {
  "en-US": [
   {
    "nazwa": null,
    "skrot": null,
    "twierdzenie": "ATL-T-010"
   }
  ]
 },
 "twierdzenia": [],
 "jezyki_gotowe": [
  "en-US"
 ]
}
