{
 "format": 1,
 "id": "skrot.szydelko.dc",
 "rzemioslo": "szydelko",
 "rodzaj": "skrot",
 "klucze": {
  "nazwa": "atlas.skrot.szydelko.dc.nazwa"
 },
 "terminy": {
  "en-US": [
   {
    "nazwa": "double crochet",
    "skrot": "dc",
    "twierdzenie": "TRM-EN-032"
   }
  ],
  "en-GB": [
   {
    "nazwa": "treble",
    "skrot": "tr",
    "twierdzenie": "TRM-GB-004"
   }
  ],
  "pl": [
   {
    "nazwa": "słupek",
    "skrot": "sł",
    "twierdzenie": "TRM-PL-034"
   }
  ],
  "sv": [
   {
    "nazwa": "stolpe",
    "skrot": "st",
    "twierdzenie": "TRM-SV-008"
   }
  ],
  "pt-BR": [
   {
    "nazwa": "ponto alto",
    "skrot": "pa.",
    "twierdzenie": "TRM-PT-003"
   }
  ],
  "ru": [
   {
    "nazwa": "столбик с накидом",
    "skrot": "ССН",
    "twierdzenie": "TRM-RU-037"
   }
  ],
  "uk": [
   {
    "nazwa": "стовпчик з накидом",
    "skrot": "СН",
    "twierdzenie": "TRM-UA-026"
   }
  ],
  "ja": [
   {
    "nazwa": "長編目",
    "skrot": null,
    "twierdzenie": "TRM-JA-033"
   }
  ],
  "ko": [
   {
    "nazwa": "한길긴뜨기",
    "skrot": null,
    "twierdzenie": "TRM-KO-019"
   }
  ],
  "tr": [
   {
    "nazwa": "düz üçlü ilmek",
    "skrot": null,
    "twierdzenie": "TRM-TR-032"
   }
  ],
  "bg": [
   {
    "nazwa": "висок пълнеж",
    "skrot": "ВП",
    "twierdzenie": "TRM-BG-030"
   }
  ],
  "lt": [
   {
    "nazwa": "stulpelis su užmetimu",
    "skrot": null,
    "twierdzenie": "TRM-LT-018"
   }
  ],
  "lv": [
   {
    "nazwa": "vienkāršais stabiņš",
    "skrot": "vst",
    "twierdzenie": "TRM-LV-013"
   }
  ],
  "ms": [
   {
    "nazwa": "sekali belit",
    "skrot": null,
    "twierdzenie": "TRM-MS-013"
   }
  ],
  "id": [
   {
    "nazwa": "tusuk ganda",
    "skrot": "dc",
    "twierdzenie": "TRM-ID-004"
   }
  ]
 },
 "twierdzenia": [],
 "jezyki_gotowe": [
  "en-US"
 ]
}
