{
 "format": 1,
 "id": "schemat.rs-ws",
 "rzemioslo": "druty",
 "rodzaj": "schemat",
 "klucze": {
  "nazwa": "atlas.schemat.rs-ws.nazwa",
  "podpis": "atlas.schemat.rs-ws.podpis",
  "opis_alt": "atlas.schemat.rs-ws.opis_alt"
 },
 "klucze_dodatkowe": [
  "atlas.schemat.rs-ws.kierunek",
  "atlas.schemat.rs-ws.znaczenie_ws",
  "atlas.schemat.rs-ws.legenda"
 ],
 "terminy": {
  "en-US": [
   {
    "nazwa": "right side",
    "skrot": "RS",
    "twierdzenie": "TRM-EN-017"
   }
  ],
  "pl": [
   {
    "nazwa": "prawa strona (robótki)",
    "skrot": null,
    "twierdzenie": "TRM-PL-038"
   }
  ],
  "sv": [
   {
    "nazwa": "rätsida",
    "skrot": null,
    "twierdzenie": "TRM-SV-019"
   }
  ],
  "ru": [
   {
    "nazwa": "лицевая сторона",
    "skrot": null,
    "twierdzenie": "TRM-RU-022"
   }
  ],
  "uk": [
   {
    "nazwa": "лицьовий бік",
    "skrot": null,
    "twierdzenie": "TRM-UA-013"
   }
  ],
  "ja": [
   {
    "nazwa": "表を見て編む段",
    "skrot": null,
    "twierdzenie": "TRM-JA-021"
   }
  ],
  "zh-Hant": [
   {
    "nazwa": "正面",
    "skrot": "RS",
    "twierdzenie": "TRM-ZHT-020"
   }
  ],
  "pt-BR": [
   {
    "nazwa": "direito do trabalho",
    "skrot": null,
    "twierdzenie": "TRM-PT-025"
   }
  ]
 },
 "twierdzenia": [],
 "jezyki_gotowe": [
  "en-US"
 ]
}
