{
 "format": 1,
 "id": "szydelko.oczko_szydelkowe.slst",
 "rzemioslo": "szydelko",
 "rodzaj": "oczko_szydelkowe",
 "klucze": {
  "nazwa": "atlas.szydelko.oczko_szydelkowe.slst.nazwa",
  "podpis": "atlas.szydelko.oczko_szydelkowe.slst.podpis",
  "opis_alt": "atlas.szydelko.oczko_szydelkowe.slst.opis_alt"
 },
 "klucze_dodatkowe": [
  "atlas.szydelko.oczko_szydelkowe.slst.nazwa_gb"
 ],
 "terminy": {
  "en-US": [
   {
    "nazwa": "slip stitch",
    "skrot": "sl st",
    "twierdzenie": "TRM-EN-029"
   }
  ],
  "en-GB": [
   {
    "nazwa": "slip stitch",
    "skrot": "ss",
    "twierdzenie": "TRM-GB-001"
   }
  ],
  "pl": [
   {
    "nazwa": "oczko zamykające",
    "skrot": "oz",
    "twierdzenie": "TRM-PL-029"
   }
  ],
  "sv": [
   {
    "nazwa": "smygmaska",
    "skrot": "sm",
    "twierdzenie": "TRM-SV-010"
   }
  ],
  "pt-BR": [
   {
    "nazwa": "ponto baixíssimo",
    "skrot": "pbx.",
    "twierdzenie": "TRM-PT-006"
   }
  ],
  "ru": [
   {
    "nazwa": "соединительный столбик",
    "skrot": "СС",
    "twierdzenie": "TRM-RU-034"
   }
  ],
  "uk": [
   {
    "nazwa": "з’єднувальний стовпчик",
    "skrot": "ЗСт",
    "twierdzenie": "TRM-UA-023"
   }
  ],
  "ja": [
   {
    "nazwa": "引抜き編目",
    "skrot": null,
    "twierdzenie": "TRM-JA-030"
   }
  ],
  "zh-Hant": [
   {
    "nazwa": "引拔針",
    "skrot": null,
    "twierdzenie": "TRM-ZHT-031"
   }
  ]
 },
 "twierdzenia": [],
 "jezyki_gotowe": [
  "en-US",
  "en-GB"
 ],
 "rysunek": {
  "rodzina": "graf-szydelkowy",
  "probka": {
   "kolumny": 4,
   "rzedy": 2
  },
  "tlo": "prawe",
  "operacja": null
 },
 "kroki": [
  {
   "faza": "tkanina",
   "petle": [
    {
     "rzad": 0,
     "kolumna": 1
    }
   ],
   "wyroznij": [
    {
     "rzad": 0,
     "kolumna": 1
    }
   ],
   "kierunek": null,
   "strzalka": null,
   "klucz": "atlas.szydelko.oczko_szydelkowe.slst.krok1"
  },
  {
   "faza": "przeciagniecie",
   "petle": [
    {
     "rzad": 0,
     "kolumna": 1
    }
   ],
   "wyroznij": [
    {
     "rzad": 0,
     "kolumna": 1
    }
   ],
   "kierunek": null,
   "petle_na_narzedziu": 1,
   "strzalka": null,
   "klucz": "atlas.szydelko.oczko_szydelkowe.slst.krok2"
  }
 ]
}
