{
 "format": 1,
 "id": "skrot.rep",
 "rzemioslo": "druty",
 "rodzaj": "skrot",
 "klucze": {
  "nazwa": "atlas.skrot.rep.nazwa"
 },
 "terminy": {
  "en-US": [
   {
    "nazwa": "repeat",
    "skrot": "rep",
    "twierdzenie": "TRM-EN-019"
   }
  ],
  "ru": [
   {
    "nazwa": "раппорт",
    "skrot": null,
    "twierdzenie": "TRM-RU-024"
   }
  ],
  "uk": [
   {
    "nazwa": "рапорт",
    "skrot": null,
    "twierdzenie": "TRM-UA-015"
   }
  ],
  "pt-BR": [
   {
    "nazwa": "repetir",
    "skrot": null,
    "twierdzenie": "TRM-PT-027"
   }
  ]
 },
 "twierdzenia": [],
 "jezyki_gotowe": [
  "en-US"
 ]
}
