{
 "format": 1,
 "id": "druty.warkocz.2-2lc",
 "rzemioslo": "druty",
 "rodzaj": "warkocz",
 "klucze": {
  "nazwa": "atlas.druty.warkocz.2-2lc.nazwa",
  "podpis": "atlas.druty.warkocz.2-2lc.podpis",
  "opis_alt": "atlas.druty.warkocz.2-2lc.opis_alt"
 },
 "klucze_dodatkowe": [
  "atlas.druty.warkocz.2-2lc.uwaga_zapis"
 ],
 "terminy": {
  "en-US": [
   {
    "nazwa": "2/2 LC",
    "skrot": "2/2 LC",
    "twierdzenie": "TRM-EN-044"
   }
  ],
  "pl": [
   {
    "nazwa": "warkocz lewy na cztery oczka",
    "skrot": "4 o. skrzyż. l.",
    "twierdzenie": "TRM-PL-018"
   }
  ],
  "ja": [
   {
    "nazwa": "右上2目交差",
    "skrot": null,
    "twierdzenie": "TRM-JA-019"
   }
  ]
 },
 "twierdzenia": [
  {
   "id": "ATL-K-061",
   "wartosc": {
    "pomocniczy": "przod"
   }
  },
  {
   "id": "ATL-K-062",
   "wartosc": {
    "pochylenie": "lewo"
   }
  }
 ],
 "jezyki_gotowe": [
  "en-US"
 ],
 "rysunek": {
  "rodzina": "siatka-petli",
  "probka": {
   "kolumny": 6,
   "rzedy": 3
  },
  "tlo": "lewe",
  "operacja": {
   "typ": "warkocz",
   "zuzywa": 4,
   "przekladane": 2,
   "pomocniczy": "przod",
   "kolumna": 1
  }
 },
 "kroki": [
  {
   "faza": "zdjecie",
   "petle": [
    {
     "rzad": 1,
     "kolumna": 1
    },
    {
     "rzad": 1,
     "kolumna": 2
    }
   ],
   "wyroznij": [
    {
     "rzad": 1,
     "kolumna": 1
    },
    {
     "rzad": 1,
     "kolumna": 2
    }
   ],
   "kierunek": null,
   "strzalka": null,
   "klucz": "atlas.druty.warkocz.2-2lc.krok1"
  },
  {
   "faza": "przeciagniecie",
   "petle": [
    {
     "rzad": 1,
     "kolumna": 3
    },
    {
     "rzad": 1,
     "kolumna": 4
    }
   ],
   "wyroznij": [
    {
     "rzad": 1,
     "kolumna": 3
    },
    {
     "rzad": 1,
     "kolumna": 4
    }
   ],
   "kierunek": null,
   "strzalka": null,
   "klucz": "atlas.druty.warkocz.2-2lc.krok2"
  },
  {
   "faza": "wynik",
   "petle": [
    {
     "rzad": 2,
     "kolumna": 1
    },
    {
     "rzad": 2,
     "kolumna": 2
    },
    {
     "rzad": 2,
     "kolumna": 3
    },
    {
     "rzad": 2,
     "kolumna": 4
    }
   ],
   "wyroznij": [
    {
     "rzad": 2,
     "kolumna": 1
    },
    {
     "rzad": 2,
     "kolumna": 2
    },
    {
     "rzad": 2,
     "kolumna": 3
    },
    {
     "rzad": 2,
     "kolumna": 4
    }
   ],
   "kierunek": null,
   "strzalka": null,
   "klucz": "atlas.druty.warkocz.2-2lc.krok3"
  }
 ]
}
